{
  "format": "EN16931-Semantic-JSON",
  "version": "1.0",
  "semanticModel": "EN16931-1:2017+A1:2019/AC:2020",
  "values": {
    "/BT-1": "123456XX",
    "/BT-2": "2016-04-04",
    "/BT-3": "380",
    "/BT-5": "EUR",
    "/BT-10": "04011000-12345-03",
    "/BT-20": "Zahlbar sofort ohne Abzug.",
    "/BG-1/0/BT-21": "ADU",
    "/BG-1/0/BT-22": "Es gelten unsere Allgem. Geschäftsbedingungen, die Sie unter […] finden.",
    "/BG-2/BT-23": "urn:fdc:peppol.eu:2017:poacc:billing:01:1.0",
    "/BG-2/BT-24": "urn:cen.eu:en16931:2017#compliant#urn:xeinkauf.de:kosit:xrechnung_3.0",
    "/BG-4/BT-27": "[Seller name]",
    "/BG-4/BT-28": "[Seller trading name]",
    "/BG-4/BT-30": "[HRA-Eintrag]",
    "/BG-4/BT-31": "DE 123456789",
    "/BG-4/BT-33": "123/456/7890, HRA-Eintrag in […]",
    "/BG-4/BT-34": {
      "value": "seller@email.de",
      "scheme": "EM"
    },
    "/BG-4/BG-5/BT-35": "[Seller address line 1]",
    "/BG-4/BG-5/BT-37": "[Seller city]",
    "/BG-4/BG-5/BT-38": "12345",
    "/BG-4/BG-5/BT-40": "DE",
    "/BG-4/BG-6/BT-41": "nicht vorhanden",
    "/BG-4/BG-6/BT-42": "+49 1234-5678",
    "/BG-4/BG-6/BT-43": "seller@email.de",
    "/BG-7/BT-44": "[Buyer name]",
    "/BG-7/BT-46": "[Buyer identifier]",
    "/BG-7/BT-49": {
      "value": "buyer@info.de",
      "scheme": "EM"
    },
    "/BG-7/BG-8/BT-50": "[Buyer address line 1]",
    "/BG-7/BG-8/BT-52": "[Buyer city]",
    "/BG-7/BG-8/BT-53": "12345",
    "/BG-7/BG-8/BT-55": "DE",
    "/BG-16/BT-81": "58",
    "/BG-16/BG-17/0/BT-84": "DE79000000001234567890",
    "/BG-22/BT-106": "314.86",
    "/BG-22/BT-109": "314.86",
    "/BG-22/BT-110": "22.04",
    "/BG-22/BT-112": "336.9",
    "/BG-22/BT-114": "0.01",
    "/BG-22/BT-115": "336.91",
    "/BG-23/0/BT-116": "314.86",
    "/BG-23/0/BT-117": "22.04",
    "/BG-23/0/BT-118": "S",
    "/BG-23/0/BT-119": "7",
    "/BG-25/0/BT-126": "Zeitschrift [...]",
    "/BG-25/0/BT-127": "Die letzte Lieferung im Rahmen des abgerechneten Abonnements erfolgt in 12/2016 Lieferung erfolgt / erfolgte direkt vom Verlag",
    "/BG-25/0/BT-129": "1",
    "/BG-25/0/BT-130": "XPP",
    "/BG-25/0/BT-131": "288.79",
    "/BG-25/0/BT-132": "6171175.1",
    "/BG-25/0/BG-26/BT-134": "2016-01-01",
    "/BG-25/0/BG-26/BT-135": "2016-12-31",
    "/BG-25/0/BG-29/BT-146": "288.79",
    "/BG-25/0/BG-30/BT-151": "S",
    "/BG-25/0/BG-30/BT-152": "7",
    "/BG-25/0/BG-31/BT-153": "Zeitschrift [...]",
    "/BG-25/0/BG-31/BT-154": "Zeitschrift Inland",
    "/BG-25/0/BG-31/BT-155": "246",
    "/BG-25/0/BG-31/BT-158/0": {
      "value": "0721-880X",
      "scheme": "IB"
    },
    "/BG-25/1/BT-126": "Porto + Versandkosten",
    "/BG-25/1/BT-129": "1",
    "/BG-25/1/BT-130": "XPP",
    "/BG-25/1/BT-131": "26.07",
    "/BG-25/1/BG-29/BT-146": "26.07",
    "/BG-25/1/BG-30/BT-151": "S",
    "/BG-25/1/BG-30/BT-152": "7",
    "/BG-25/1/BG-31/BT-153": "Porto + Versandkosten"
  },
  "source": {
    "syntax": "UBL",
    "sha256": "54f477a8ddc0488f0b5a03977ab1fa8b94d735c7b90f0a51e56aeff6112f3392"
  }
}
