{
  "format": "EN16931-Semantic-JSON",
  "version": "1.0",
  "semanticModel": "EN16931-1:2017+A1:2019/AC:2020",
  "values": {
    "/BT-1": "1234567890",
    "/BT-2": "2021-01-25",
    "/BT-3": "389",
    "/BT-5": "EUR",
    "/BT-9": "2021-02-04",
    "/BT-10": "1234567890-54321-40",
    "/BT-13": "Bestellung XRechnung",
    "/BT-20": "Zahlbar unter Angabe der Rechungs- und Debitornummer sofort netto Kasse; fällig zum 04.02.2021 ohne Abzug",
    "/BG-1/0/BT-21": "REG",
    "/BG-1/0/BT-22": "Betriebsstätte",
    "/BG-2/BT-23": "urn:fdc:peppol.eu:2017:poacc:billing:01:1.0",
    "/BG-2/BT-24": "urn:cen.eu:en16931:2017#compliant#urn:xeinkauf.de:kosit:xrechnung_3.0",
    "/BG-4/BT-27": "Betriebsstätte",
    "/BG-4/BT-31": "DE123456789",
    "/BG-4/BT-34": {
      "value": "seller@email.de",
      "scheme": "EM"
    },
    "/BG-4/BG-5/BT-35": "[Seller street]",
    "/BG-4/BG-5/BT-37": "[Seller city]",
    "/BG-4/BG-5/BT-38": "12345",
    "/BG-4/BG-5/BT-40": "DE",
    "/BG-4/BG-6/BT-41": "Reimund Kann",
    "/BG-4/BG-6/BT-42": "0123456789",
    "/BG-4/BG-6/BT-43": "test@test.de",
    "/BG-7/BT-44": "Kunde 1",
    "/BG-7/BT-48": "DE987654321",
    "/BG-7/BT-49": {
      "value": "buyer@info.de",
      "scheme": "EM"
    },
    "/BG-7/BG-8/BT-50": "[Street]",
    "/BG-7/BG-8/BT-52": "[City]",
    "/BG-7/BG-8/BT-53": "12345",
    "/BG-7/BG-8/BT-55": "DE",
    "/BG-13/BT-70": "[ShipToTradeParty]",
    "/BG-13/BT-72": "2021-01-25",
    "/BG-13/BG-15/BT-75": "[Street]",
    "/BG-13/BG-15/BT-77": "[City]",
    "/BG-13/BG-15/BT-78": "54321",
    "/BG-13/BG-15/BT-80": "DE",
    "/BG-16/BT-81": "42",
    "/BG-16/BT-82": "Bank transfer",
    "/BG-16/BT-83": "1234567890",
    "/BG-16/BG-17/0/BT-84": "DE79000000001234567890",
    "/BG-16/BG-17/0/BT-85": "Postbank Düsseldorf",
    "/BG-16/BG-17/0/BT-86": "PBNKDEFF",
    "/BG-22/BT-106": "300",
    "/BG-22/BT-109": "300",
    "/BG-22/BT-110": "57",
    "/BG-22/BT-112": "357",
    "/BG-22/BT-115": "357",
    "/BG-23/0/BT-116": "300",
    "/BG-23/0/BT-117": "57",
    "/BG-23/0/BT-118": "S",
    "/BG-23/0/BT-119": "19",
    "/BG-25/0/BT-126": "1",
    "/BG-25/0/BT-129": "-1",
    "/BG-25/0/BT-130": "C62",
    "/BG-25/0/BT-131": "-100",
    "/BG-25/0/BG-26/BT-134": "2021-01-25",
    "/BG-25/0/BG-26/BT-135": "2021-01-25",
    "/BG-25/0/BG-29/BT-146": "100",
    "/BG-25/0/BG-29/BT-147": "10",
    "/BG-25/0/BG-29/BT-148": "110",
    "/BG-25/0/BG-29/BT-149": "1",
    "/BG-25/0/BG-29/BT-150": "C62",
    "/BG-25/0/BG-30/BT-151": "S",
    "/BG-25/0/BG-30/BT-152": "19",
    "/BG-25/0/BG-31/BT-153": "Behältermiete",
    "/BG-25/1/BT-126": "2",
    "/BG-25/1/BT-129": "4",
    "/BG-25/1/BT-130": "TNE",
    "/BG-25/1/BT-131": "400",
    "/BG-25/1/BG-26/BT-134": "2021-01-25",
    "/BG-25/1/BG-26/BT-135": "2021-01-25",
    "/BG-25/1/BG-29/BT-146": "100",
    "/BG-25/1/BG-29/BT-147": "10",
    "/BG-25/1/BG-29/BT-148": "110",
    "/BG-25/1/BG-29/BT-149": "1",
    "/BG-25/1/BG-29/BT-150": "TNE",
    "/BG-25/1/BG-30/BT-151": "S",
    "/BG-25/1/BG-30/BT-152": "19",
    "/BG-25/1/BG-31/BT-153": "Entsorgung",
    "/BG-25/1/BG-31/BT-154": "Ersatztext bei Entsorgung"
  },
  "source": {
    "syntax": "UBL",
    "sha256": "51fe9b285d86eb57bdb5bfe2682e62dce485af71c003b56b447d5bdc1b61c368"
  }
}
