{"format":"EN16931-Semantic-JSON","version":"0.1","semanticModel":"EN16931-1:2017+A1:2019/AC:2020","values":{"/BT-1":"RE-2026-0001"},"extensions":{"de.example.vendor":{"capitalExponent":100,"fractionAt64":0.00000000000000000000000000000000000000000000000000000000000001,"fractionTimesTen":1,"hundredthsOfHundred":1,"integerAt64":1111111111111111111111111111111111111111111111111111111111111111,"negativeAt64":-0.0000000000000000000000000000000000000000000000000000000000001,"negativeTrailingZero":-12,"negativeZeroWithExponent":0,"objectsInAnArray":[{"a":2,"b":1},{"c":null,"d":[3,4]}],"signedExponent":100,"trailingZeros":12.34,"zeroWithLargeExponent":0}}}