{
  "format": "EN16931-Semantic-JSON",
  "version": "1.0",
  "semanticModel": "EN16931-1:2017+A1:2019/AC:2020",
  "values": {
    "/BT-1": "RE-2026-0002",
    "/BT-2": "2026-01-15",
    "/BT-3": "380",
    "/BT-5": "EUR",
    "/BT-9": "2026-02-14",
    "/BG-2/BT-24": "urn:cen.eu:en16931:2017",
    "/BG-4/BT-27": "Example GmbH",
    "/BG-4/BT-31": "DE123456789",
    "/BG-4/BG-5/BT-40": "DE",
    "/BG-7/BT-44": "Muster AG",
    "/BG-7/BG-8/BT-55": "DE",
    "/BG-22/BT-106": "100",
    "/BG-22/BT-109": "100",
    "/BG-22/BT-110": "0",
    "/BG-22/BT-112": "100",
    "/BG-22/BT-115": "100",
    "/BG-23/0/BT-116": "100",
    "/BG-23/0/BT-117": "0",
    "/BG-23/0/BT-118": "Z",
    "/BG-23/0/BT-119": "0",
    "/BG-25/0/BT-126": "1",
    "/BG-25/0/BT-129": "1",
    "/BG-25/0/BT-130": "C62",
    "/BG-25/0/BT-131": "100",
    "/BG-25/0/BG-29/BT-146": "100",
    "/BG-25/0/BG-30/BT-151": "Z",
    "/BG-25/0/BG-30/BT-152": "0",
    "/BG-25/0/BG-31/BT-153": "Consulting service"
  }
}
