{
  "format": "EN16931-Semantic-JSON",
  "version": "1.0",
  "semanticModel": "EN16931-1:2017+A1:2019/AC:2020",
  "values": {
    "/BT-1": "RE-2026-0731",
    "/BT-2": "2026-04-14",
    "/BT-3": "380",
    "/BT-5": "EUR",
    "/BT-9": "2026-04-28",
    "/BT-20": "Payable within 14 days without deduction.",
    "/BT-B2C-010": "153.47",
    "/BG-2/BT-24": "urn:cen.eu:en16931:2017",
    "/BG-4/BT-27": "Beispiel Handels GmbH",
    "/BG-4/BT-31": "DE123456789",
    "/BG-4/BT-34": {
      "value": "shop@beispiel.invalid",
      "scheme": "EM"
    },
    "/BG-4/BG-5/BT-35": "Werkstrasse 8",
    "/BG-4/BG-5/BT-37": "Beispielstadt",
    "/BG-4/BG-5/BT-38": "10117",
    "/BG-4/BG-5/BT-40": "DE",
    "/BG-7/BT-44": "Jana Muster",
    "/BG-7/BG-8/BT-50": "Lindenweg 4",
    "/BG-7/BG-8/BT-52": "Musterstadt",
    "/BG-7/BG-8/BT-53": "20095",
    "/BG-7/BG-8/BT-55": "DE",
    "/BG-16/BT-81": "58",
    "/BG-16/BT-83": "RE-2026-0731",
    "/BG-16/BG-17/0/BT-84": "DE89370400440532013000",
    "/BG-16/BG-17/0/BT-85": "Beispiel Handels GmbH",
    "/BG-22/BT-106": "128.97",
    "/BG-22/BT-109": "128.97",
    "/BG-22/BT-110": "24.5",
    "/BG-22/BT-112": "153.47",
    "/BG-22/BT-115": "153.47",
    "/BG-23/0/BT-116": "128.97",
    "/BG-23/0/BT-117": "24.5",
    "/BG-23/0/BT-118": "S",
    "/BG-23/0/BT-119": "19",
    "/BG-25/0/BT-126": "1",
    "/BG-25/0/BT-129": "1",
    "/BG-25/0/BT-130": "H87",
    "/BG-25/0/BT-131": "84.03",
    "/BG-25/0/BT-B2C-001": "99.99",
    "/BG-25/0/BT-B2C-002": "99.99",
    "/BG-25/0/BT-B2C-003": "15.96",
    "/BG-25/0/BG-29/BT-146": "84.02521",
    "/BG-25/0/BG-30/BT-151": "S",
    "/BG-25/0/BG-30/BT-152": "19",
    "/BG-25/0/BG-31/BT-153": "Shower fitting SF-20",
    "/BG-25/1/BT-126": "2",
    "/BG-25/1/BT-129": "2",
    "/BG-25/1/BT-130": "H87",
    "/BG-25/1/BT-131": "33.6",
    "/BG-25/1/BT-B2C-001": "19.99",
    "/BG-25/1/BT-B2C-002": "39.98",
    "/BG-25/1/BT-B2C-003": "6.38",
    "/BG-25/1/BG-29/BT-146": "16.798319",
    "/BG-25/1/BG-30/BT-151": "S",
    "/BG-25/1/BG-30/BT-152": "19",
    "/BG-25/1/BG-31/BT-153": "Shower hose 1.5 m",
    "/BG-25/2/BT-126": "3",
    "/BG-25/2/BT-129": "3",
    "/BG-25/2/BT-130": "H87",
    "/BG-25/2/BT-131": "11.34",
    "/BG-25/2/BT-B2C-001": "4.5",
    "/BG-25/2/BT-B2C-002": "13.5",
    "/BG-25/2/BT-B2C-003": "2.16",
    "/BG-25/2/BG-29/BT-146": "3.781513",
    "/BG-25/2/BG-30/BT-151": "S",
    "/BG-25/2/BG-30/BT-152": "19",
    "/BG-25/2/BG-31/BT-153": "Sealing tape 12 m"
  }
}
