{"format":"EN16931-Semantic-JSON","version":"1.0","semanticModel":"EN16931-1:2017+A1:2019/AC:2020","values":{"/BT-1":"RE-2026-0211","/BT-2":"2026-05-12","/BT-3":"380","/BT-5":"EUR","/BT-9":"2026-06-11","/BT-20":"Payable within 30 days without deduction.","/BG-2/BT-24":"urn:cen.eu:en16931:2017","/BG-4/BT-27":"Example GmbH","/BG-4/BT-31":"DE123456789","/BG-4/BG-5/BT-35":"Musterweg 12","/BG-4/BG-5/BT-37":"Beispielstadt","/BG-4/BG-5/BT-38":"10117","/BG-4/BG-5/BT-40":"DE","/BG-7/BT-44":"Muster AG","/BG-7/BT-48":"DE987654321","/BG-7/BG-8/BT-50":"Beispielallee 3","/BG-7/BG-8/BT-52":"Musterstadt","/BG-7/BG-8/BT-53":"20095","/BG-7/BG-8/BT-55":"DE","/BG-16/BT-81":"58","/BG-16/BG-17/0/BT-84":"DE89370400440532013000","/BG-20/0/BT-92":"100","/BG-20/0/BT-95":"S","/BG-20/0/BT-96":"19","/BG-20/0/BT-97":"Annual volume rebate","/BG-20/0/BT-98":"100","/BG-20/1/BT-92":"50","/BG-20/1/BT-95":"S","/BG-20/1/BT-96":"7","/BG-20/1/BT-97":"Annual volume rebate","/BG-20/1/BT-98":"100","/BG-22/BT-106":"2055","/BG-22/BT-107":"150","/BG-22/BT-109":"1905","/BG-22/BT-110":"250.95","/BG-22/BT-112":"2155.95","/BG-22/BT-115":"2155.95","/BG-23/0/BT-116":"980","/BG-23/0/BT-117":"186.2","/BG-23/0/BT-118":"S","/BG-23/0/BT-119":"19","/BG-23/1/BT-116":"925","/BG-23/1/BT-117":"64.75","/BG-23/1/BT-118":"S","/BG-23/1/BT-119":"7","/BG-25/0/BT-126":"1","/BG-25/0/BT-129":"100","/BG-25/0/BT-130":"H87","/BG-25/0/BT-131":"1080","/BG-25/0/BG-27/0/BT-136":"120","/BG-25/0/BG-27/0/BT-137":"1200","/BG-25/0/BG-27/0/BT-138":"10","/BG-25/0/BG-27/0/BT-139":"Quantity discount","/BG-25/0/BG-27/0/BT-140":"95","/BG-25/0/BG-29/BT-146":"12","/BG-25/0/BG-30/BT-151":"S","/BG-25/0/BG-30/BT-152":"19","/BG-25/0/BG-31/BT-153":"Sensor module SM-100","/BG-25/1/BT-126":"2","/BG-25/1/BT-129":"5","/BG-25/1/BT-130":"H87","/BG-25/1/BT-131":"975","/BG-25/1/BG-27/0/BT-136":"25","/BG-25/1/BG-27/0/BT-139":"Damaged packaging","/BG-25/1/BG-27/0/BT-140":"64","/BG-25/1/BG-29/BT-146":"200","/BG-25/1/BG-30/BT-151":"S","/BG-25/1/BG-30/BT-152":"7","/BG-25/1/BG-31/BT-153":"Printed documentation set"}}