{
  "format": "EN16931-Semantic-JSON",
  "version": "1.0",
  "semanticModel": "EN16931-1:2017+A1:2019/AC:2020",
  "values": {
    "/BT-1": "Rechnungsnummer",
    "/BT-2": "2016-02-23",
    "/BT-3": "380",
    "/BT-5": "EUR",
    "/BT-9": "2016-03-08",
    "/BT-10": "04011000-12352-79",
    "/BT-13": "Dummywert",
    "/BT-14": "Auftragsnummer",
    "/BG-2/BT-23": "urn:fdc:peppol.eu:2017:poacc:billing:01:1.0",
    "/BG-2/BT-24": "urn:cen.eu:en16931:2017#compliant#urn:xeinkauf.de:kosit:xrechnung_3.0",
    "/BG-4/BT-27": "[Seller name]",
    "/BG-4/BT-28": "[Seller trading name]",
    "/BG-4/BT-30": "HRB 123",
    "/BG-4/BT-31": "DE123456789",
    "/BG-4/BT-33": "Amtsgericht […], Geschäftsführer: […], Sitz der Gesellschaft […], Aufsichtsratvorsitzender: […]",
    "/BG-4/BT-34": {
      "value": "seller@email.de",
      "scheme": "EM"
    },
    "/BG-4/BG-5/BT-35": "[Seller address line 1]",
    "/BG-4/BG-5/BT-37": "[Seller city]",
    "/BG-4/BG-5/BT-38": "12345",
    "/BG-4/BG-5/BT-40": "DE",
    "/BG-4/BG-6/BT-41": "Auskunft erteilt Ihnen",
    "/BG-4/BG-6/BT-42": "1234567890",
    "/BG-4/BG-6/BT-43": "seller@test.de",
    "/BG-7/BT-44": "[Buyer name]",
    "/BG-7/BT-49": {
      "value": "buyer@info.de",
      "scheme": "EM"
    },
    "/BG-7/BG-8/BT-50": "[Buyer address line 1]",
    "/BG-7/BG-8/BT-52": "[Buyer city]",
    "/BG-7/BG-8/BT-53": "12345",
    "/BG-7/BG-8/BT-55": "DE",
    "/BG-16/BT-81": "58",
    "/BG-16/BG-17/0/BT-84": "DE79000000001234567890",
    "/BG-16/BG-17/1/BT-84": "DE16000000002345678901",
    "/BG-16/BG-17/2/BT-84": "DE03000000003456789012",
    "/BG-22/BT-106": "234.77",
    "/BG-22/BT-109": "234.77",
    "/BG-22/BT-110": "44.61",
    "/BG-22/BT-112": "279.38",
    "/BG-22/BT-115": "279.38",
    "/BG-23/0/BT-116": "234.77",
    "/BG-23/0/BT-117": "44.61",
    "/BG-23/0/BT-118": "S",
    "/BG-23/0/BT-119": "19",
    "/BG-25/0/BT-126": "0010",
    "/BG-25/0/BT-129": "3",
    "/BG-25/0/BT-130": "XPP",
    "/BG-25/0/BT-131": "214.26",
    "/BG-25/0/BG-29/BT-146": "71.42",
    "/BG-25/0/BG-30/BT-151": "S",
    "/BG-25/0/BG-30/BT-152": "19",
    "/BG-25/0/BG-31/BT-153": "Huawei E5573 Mobiler 4G Hotspot sw",
    "/BG-25/0/BG-31/BT-155": "CON-1401888",
    "/BG-25/1/BT-126": "0020",
    "/BG-25/1/BT-129": "1",
    "/BG-25/1/BT-130": "XPP",
    "/BG-25/1/BT-131": "10.71",
    "/BG-25/1/BG-29/BT-146": "10.71",
    "/BG-25/1/BG-30/BT-151": "S",
    "/BG-25/1/BG-30/BT-152": "19",
    "/BG-25/1/BG-31/BT-153": "Beschaffungspauschale",
    "/BG-25/1/BG-31/BT-155": "51001",
    "/BG-25/2/BT-126": "0030",
    "/BG-25/2/BT-129": "1",
    "/BG-25/2/BT-130": "XPP",
    "/BG-25/2/BT-131": "9.8",
    "/BG-25/2/BG-29/BT-146": "9.8",
    "/BG-25/2/BG-30/BT-151": "S",
    "/BG-25/2/BG-30/BT-152": "19",
    "/BG-25/2/BG-31/BT-153": "Lieferkosten",
    "/BG-25/2/BG-31/BT-155": "51010"
  },
  "source": {
    "syntax": "UBL",
    "sha256": "3f413a4f33c3844e184480f609d3f4eb31c8165431be03157d6eb84f53be514d"
  }
}
