{"format":"EN16931-Semantic-JSON","version":"1.0","semanticModel":"EN16931-1:2017+A1:2019/AC:2020","values":{"/BT-1":"RE-2026-0316","/BT-2":"2026-06-08","/BT-3":"380","/BT-5":"EUR","/BT-9":"2026-07-08","/BT-20":"Payable within 30 days without deduction.","/BG-2/BT-24":"urn:cen.eu:en16931:2017","/BG-4/BT-27":"Beispiel Handels GmbH","/BG-4/BT-31":"ATU12345678","/BG-4/BG-5/BT-35":"Mustergasse 5","/BG-4/BG-5/BT-37":"Beispielstadt","/BG-4/BG-5/BT-38":"1010","/BG-4/BG-5/BT-40":"AT","/BG-7/BT-44":"Muster AG","/BG-7/BT-48":"DE987654321","/BG-7/BG-8/BT-50":"Beispielallee 3","/BG-7/BG-8/BT-52":"Musterstadt","/BG-7/BG-8/BT-53":"20095","/BG-7/BG-8/BT-55":"DE","/BG-11/BT-62":"Steuervertretung Beispiel GmbH","/BG-11/BT-63":"DE111222333","/BG-11/BG-12/BT-64":"Vertretungsweg 2","/BG-11/BG-12/BT-66":"Beispielstadt","/BG-11/BG-12/BT-67":"10117","/BG-11/BG-12/BT-69":"DE","/BG-16/BT-81":"48","/BG-16/BT-82":"Payment by company card at delivery","/BG-16/BG-18/BT-87":"******1234","/BG-16/BG-18/BT-88":"Muster AG","/BG-21/0/BT-99":"85","/BG-21/0/BT-102":"S","/BG-21/0/BT-103":"19","/BG-21/0/BT-104":"Freight","/BG-21/0/BT-105":"FC","/BG-22/BT-106":"1565","/BG-22/BT-108":"85","/BG-22/BT-109":"1650","/BG-22/BT-110":"313.5","/BG-22/BT-112":"1963.5","/BG-22/BT-115":"1963.5","/BG-23/0/BT-116":"1650","/BG-23/0/BT-117":"313.5","/BG-23/0/BT-118":"S","/BG-23/0/BT-119":"19","/BG-25/0/BT-126":"1","/BG-25/0/BT-129":"20","/BG-25/0/BT-130":"H87","/BG-25/0/BT-131":"945","/BG-25/0/BG-28/0/BT-141":"45","/BG-25/0/BG-28/0/BT-142":"900","/BG-25/0/BG-28/0/BT-143":"5","/BG-25/0/BG-28/0/BT-144":"Packing","/BG-25/0/BG-28/0/BT-145":"PC","/BG-25/0/BG-29/BT-146":"45","/BG-25/0/BG-30/BT-151":"S","/BG-25/0/BG-30/BT-152":"19","/BG-25/0/BG-31/BT-153":"Sensor module SM-100","/BG-25/1/BT-126":"2","/BG-25/1/BT-129":"2","/BG-25/1/BT-130":"C62","/BG-25/1/BT-131":"620","/BG-25/1/BG-29/BT-146":"310","/BG-25/1/BG-30/BT-151":"S","/BG-25/1/BG-30/BT-152":"19","/BG-25/1/BG-31/BT-153":"Calibration service"}}