{
  "format": "EN16931-Semantic-JSON",
  "version": "1.0",
  "semanticModel": "EN16931-1:2017+A1:2019/AC:2020",
  "values": {
    "/BT-1": "123456",
    "/BT-2": "2016-06-21",
    "/BT-3": "380",
    "/BT-5": "EUR",
    "/BT-10": "04011000-12346-97",
    "/BT-13": "Dummywert",
    "/BT-14": "SO12345678",
    "/BT-20": "Bitte überweisen Sie den Betrag innerhalb von 14 Tagen auf unten stehendes Konto. Das Rechnungsdatum entspricht dem Versanddatum.",
    "/BG-1/0/BT-21": "ADU",
    "/BG-1/0/BT-22": "Bei Fragen zu Ihrer Rechnung wenden Sie sich bitte an unseren Kundenserivce. Sie erreichen uns per Email: […], Tel.: […] oder Fax: […]",
    "/BG-1/1/BT-21": "ADU",
    "/BG-1/1/BT-22": "Die Lieferung erfolgt aufgrund der AGB […] erhältlich unter […]. Auf Wunsch senden wir sie auch zu.",
    "/BG-1/2/BT-21": "ADU",
    "/BG-1/2/BT-22": "Hinweis gemäß § 33 BDSG: Kundendaten werden gespeichert.",
    "/BG-1/3/BT-21": "ADU",
    "/BG-1/3/BT-22": "Beschädigt eingehende Sendungen bitte sofort beim Spediteur bzw. Paketdienstleister reklamieren. Genehmigte Rücksendungen schicken Sie bitte mit den Unterlagen an: […]",
    "/BG-2/BT-23": "urn:fdc:peppol.eu:2017:poacc:billing:01:1.0",
    "/BG-2/BT-24": "urn:cen.eu:en16931:2017#compliant#urn:xeinkauf.de:kosit:xrechnung_3.0",
    "/BG-4/BT-27": "[Seller name]",
    "/BG-4/BT-28": "[Seller trading name]",
    "/BG-4/BT-30": "[HRB-Eintrag]",
    "/BG-4/BT-31": "DE123456789",
    "/BG-4/BT-33": "Geschäftsführer: […], Sitz der GmbH ist […], Amtsgericht […]",
    "/BG-4/BT-34": {
      "value": "seller@email.de",
      "scheme": "EM"
    },
    "/BG-4/BG-5/BT-35": "[Seller address line 1]",
    "/BG-4/BG-5/BT-37": "[Seller city]",
    "/BG-4/BG-5/BT-38": "12345",
    "/BG-4/BG-5/BT-40": "DE",
    "/BG-4/BG-6/BT-41": "-",
    "/BG-4/BG-6/BT-42": "[012-3456789]",
    "/BG-4/BG-6/BT-43": "Seller@email.de",
    "/BG-7/BT-44": "[Buyer name]",
    "/BG-7/BT-46": "BI12345678",
    "/BG-7/BT-49": {
      "value": "buyer@info.de",
      "scheme": "EM"
    },
    "/BG-7/BG-8/BT-50": "[Buyer address line 1]",
    "/BG-7/BG-8/BT-52": "[Buyer city]",
    "/BG-7/BG-8/BT-53": "12345",
    "/BG-7/BG-8/BT-55": "DE",
    "/BG-7/BG-9/BT-56": "[Buyer contact person]",
    "/BG-10/BT-59": "VSB - Verlagsservice Braunschweig GmbH",
    "/BG-13/BT-72": "2016-06-21",
    "/BG-16/BT-81": "58",
    "/BG-16/BG-17/0/BT-84": "DE79000000001234567890",
    "/BG-22/BT-106": "11.78",
    "/BG-22/BT-109": "11.78",
    "/BG-22/BT-110": "0.82",
    "/BG-22/BT-112": "12.6",
    "/BG-22/BT-115": "12.6",
    "/BG-23/0/BT-116": "11.78",
    "/BG-23/0/BT-117": "0.82",
    "/BG-23/0/BT-118": "S",
    "/BG-23/0/BT-119": "7",
    "/BG-25/0/BT-126": "SZ300540",
    "/BG-25/0/BT-129": "1",
    "/BG-25/0/BT-130": "XPP",
    "/BG-25/0/BT-131": "11.78",
    "/BG-25/0/BG-29/BT-146": "11.78",
    "/BG-25/0/BG-30/BT-151": "S",
    "/BG-25/0/BG-30/BT-152": "7",
    "/BG-25/0/BG-31/BT-153": "Denk doch, wie du willst",
    "/BG-25/0/BG-31/BT-154": "Einblicke v. Deutschlands wicht. Ökonomen",
    "/BG-25/0/BG-31/BT-155": "SZ300540"
  },
  "source": {
    "syntax": "UBL",
    "sha256": "0250e3d8d45b14f0ba31c0e928d532ca4fb228442a204d392775aee1cb725501"
  }
}
