{
  "format": "EN16931-Semantic-JSON",
  "version": "1.0",
  "semanticModel": "EN16931-1:2017+A1:2019/AC:2020",
  "values": {
    "/BT-1": "GU-2026-0004",
    "/BT-2": "2026-02-20",
    "/BT-3": "381",
    "/BT-5": "EUR",
    "/BT-9": "2026-03-20",
    "/BT-10": "KOST-4711",
    "/BT-11": "PR-2026-0007",
    "/BT-13": "BE-2026-0091",
    "/BT-18": {
      "value": "OBJ-42",
      "scheme": "AAJ"
    },
    "/BG-1/0/BT-22": "Credit note for two sensor modules returned on 18 February 2026.",
    "/BG-2/BT-23": "urn:fdc:peppol.eu:2017:poacc:billing:01:1.0",
    "/BG-2/BT-24": "urn:cen.eu:en16931:2017",
    "/BG-3/0/BT-25": "RE-2026-0042",
    "/BG-3/0/BT-26": "2026-02-03",
    "/BG-4/BT-27": "Example GmbH",
    "/BG-4/BT-31": "DE123456789",
    "/BG-4/BG-5/BT-35": "Musterweg 12",
    "/BG-4/BG-5/BT-37": "Beispielstadt",
    "/BG-4/BG-5/BT-38": "10117",
    "/BG-4/BG-5/BT-40": "DE",
    "/BG-7/BT-44": "Muster AG",
    "/BG-7/BT-48": "DE987654321",
    "/BG-7/BG-8/BT-50": "Beispielallee 3",
    "/BG-7/BG-8/BT-52": "Musterstadt",
    "/BG-7/BG-8/BT-53": "20095",
    "/BG-7/BG-8/BT-55": "DE",
    "/BG-11/BT-62": "Beispiel Steuerberatung GmbH",
    "/BG-11/BT-63": "DE555666777",
    "/BG-11/BG-12/BT-64": "Kanzleistrasse 9",
    "/BG-11/BG-12/BT-67": "60311",
    "/BG-11/BG-12/BT-68": "Hessen",
    "/BG-11/BG-12/BT-69": "DE",
    "/BG-16/BT-81": "58",
    "/BG-16/BG-17/0/BT-84": "DE12500105170648489890",
    "/BG-16/BG-17/0/BT-85": "Muster AG",
    "/BG-22/BT-106": "299",
    "/BG-22/BT-109": "299",
    "/BG-22/BT-110": "56.81",
    "/BG-22/BT-112": "355.81",
    "/BG-22/BT-115": "355.81",
    "/BG-23/0/BT-116": "299",
    "/BG-23/0/BT-117": "56.81",
    "/BG-23/0/BT-118": "S",
    "/BG-23/0/BT-119": "19",
    "/BG-24/0/BT-122": "ATT-1",
    "/BG-24/0/BT-123": "Return delivery note",
    "/BG-25/0/BT-126": "1",
    "/BG-25/0/BT-127": "Returned goods, credited in full.",
    "/BG-25/0/BT-129": "2",
    "/BG-25/0/BT-130": "H87",
    "/BG-25/0/BT-131": "299",
    "/BG-25/0/BT-132": "10",
    "/BG-25/0/BG-29/BT-146": "149.5",
    "/BG-25/0/BG-30/BT-151": "S",
    "/BG-25/0/BG-30/BT-152": "19",
    "/BG-25/0/BG-31/BT-153": "Sensor module SM-100",
    "/BG-25/0/BG-31/BT-155": "SM-100"
  },
  "source": {
    "syntax": "UBL",
    "sha256": "8a090e731c6291aeafabe687c6569acb838a4e3c68e7240e6c71781247def95e"
  }
}
