{"format":"EN16931-Semantic-JSON","version":"1.0","semanticModel":"EN16931-1:2017+A1:2019/AC:2020","values":{"/BT-1":"GS-2026-0009","/BT-2":"2026-07-01","/BT-3":"389","/BT-5":"EUR","/BT-9":"2026-07-15","/BT-10":"GS-RAHMEN-2026","/BT-20":"Settled by direct debit on the due date.","/BG-1/0/BT-21":"AAB","/BG-1/0/BT-22":"Self-billed invoice issued by the buyer on behalf of the seller.","/BG-2/BT-24":"urn:cen.eu:en16931:2017","/BG-4/BT-27":"Example GmbH","/BG-4/BT-31":"DE123456789","/BG-4/BG-5/BT-35":"Musterweg 12","/BG-4/BG-5/BT-37":"Beispielstadt","/BG-4/BG-5/BT-38":"10117","/BG-4/BG-5/BT-40":"DE","/BG-7/BT-44":"Muster AG","/BG-7/BT-48":"DE987654321","/BG-7/BG-8/BT-50":"Beispielallee 3","/BG-7/BG-8/BT-52":"Musterstadt","/BG-7/BG-8/BT-53":"20095","/BG-7/BG-8/BT-55":"DE","/BG-10/BT-59":"Beispiel Factoring GmbH","/BG-10/BT-60":{"value":"4399903000030","scheme":"0088"},"/BG-16/BT-81":"59","/BG-16/BT-83":"GS-2026-0009","/BG-16/BG-19/BT-89":"MND-2026-0042","/BG-16/BG-19/BT-90":"DE98ZZZ09999999999","/BG-16/BG-19/BT-91":"DE89370400440532013000","/BG-22/BT-106":"4840","/BG-22/BT-109":"4840","/BG-22/BT-110":"646","/BG-22/BT-112":"5486","/BG-22/BT-115":"5486","/BG-23/0/BT-116":"3400","/BG-23/0/BT-117":"646","/BG-23/0/BT-118":"S","/BG-23/0/BT-119":"19","/BG-23/1/BT-116":"1440","/BG-23/1/BT-117":"0","/BG-23/1/BT-118":"AE","/BG-23/1/BT-119":"0","/BG-23/1/BT-120":"Reverse charge","/BG-23/1/BT-121":"VATEX-EU-AE","/BG-25/0/BT-126":"1","/BG-25/0/BT-129":"40","/BG-25/0/BT-130":"HUR","/BG-25/0/BT-131":"3400","/BG-25/0/BG-29/BT-146":"85","/BG-25/0/BG-30/BT-151":"S","/BG-25/0/BG-30/BT-152":"19","/BG-25/0/BG-31/BT-153":"Development service, sprint 12","/BG-25/1/BT-126":"2","/BG-25/1/BT-127":"Reverse charge applies to this line.","/BG-25/1/BT-129":"12","/BG-25/1/BT-130":"HUR","/BG-25/1/BT-131":"1440","/BG-25/1/BG-29/BT-146":"120","/BG-25/1/BG-30/BT-151":"AE","/BG-25/1/BG-30/BT-152":"0","/BG-25/1/BG-31/BT-153":"Architecture review"}}