{"format":"EN16931-Semantic-JSON","version":"1.0","semanticModel":"EN16931-1:2017+A1:2019/AC:2020","values":{"/BT-1":"RE-2026-0001","/BT-2":"2026-01-15","/BT-3":"380","/BT-5":"EUR","/BG-2/BT-24":"urn:cen.eu:en16931:2017","/BG-4/BT-27":"Example GmbH","/BG-4/BT-29/0":{"value":"4000001123452","scheme":"0088"},"/BG-4/BG-5/BT-40":"DE","/BG-7/BT-44":"Muster AG","/BG-7/BG-8/BT-55":"DE","/BG-22/BT-106":"100","/BG-22/BT-109":"100","/BG-22/BT-112":"100","/BG-22/BT-115":"100","/BG-23/0/BT-116":"100","/BG-23/0/BT-117":"0","/BG-23/0/BT-118":"Z","/BG-24/0/BT-122":"ATT-1","/BG-24/0/BT-125":{"value":"QUJD","mimeCode":"application/pdf","filename":"note.pdf"},"/BG-25/0/BT-126":"1","/BG-25/0/BT-129":"1","/BG-25/0/BT-130":"C62","/BG-25/0/BT-131":"100","/BG-25/0/BG-29/BT-146":"100","/BG-25/0/BG-30/BT-151":"Z","/BG-25/0/BG-31/BT-153":"Consulting service","/BG-25/0/BG-31/BT-158/0":{"value":"12345","scheme":"STI","schemeVersion":"2.1"}},"source":{"syntax":"UBL","sha256":"228f74263f1a2795e21bc4a659c60afbe31a4ba71392e335e3e5e68953731be5"}}