{
  "format": "EN16931-Semantic-JSON",
  "version": "0.1",
  "semanticModel": "EN16931-1:2017+A1:2019/AC:2020",
  "values": {
    "/BT-1": "RE-2026-0001",
    "/BT-2": "2026-01-15",
    "/BT-3": "380",
    "/BT-5": "EUR",
    "/BG-2/BT-24": "urn:cen.eu:en16931:2017",
    "/BG-4/BT-27": "Example GmbH",
    "/BG-4/BG-5/BT-40": "DE",
    "/BG-7/BT-44": "Muster AG",
    "/BG-7/BG-8/BT-55": "DE",
    "/BG-22/BT-106": "100",
    "/BG-22/BT-109": "100",
    "/BG-22/BT-112": "100",
    "/BG-22/BT-115": "100",
    "/BG-23/0/BT-116": "100",
    "/BG-23/0/BT-117": "0",
    "/BG-23/0/BT-118": "Z",
    "/BG-25/0/BT-126": "1",
    "/BG-25/0/BT-129": "1",
    "/BG-25/0/BT-130": "C62",
    "/BG-25/0/BT-131": "100",
    "/BG-25/0/BG-29/BT-146": "100",
    "/BG-25/0/BG-30/BT-151": "Z",
    "/BG-25/0/BG-31/BT-153": "Consulting service"
  },
  "extensions": {
    "de.example.archive": {
      "immutable": true,
      "retentionYears": 10
    },
    "de.example.vendor": {
      "a": "ASCII member name; sorts first under every ordering rule",
      "literals": [
        true,
        false,
        null
      ],
      "numbers": {
        "exponentNegativeSeven": 1e-7,
        "exponentNegativeSix": 1e-6,
        "exponentPositive": 1e21,
        "negativeZeroFraction": -0.0,
        "negativeZeroInteger": -0,
        "seventeenSignificantDigits": 1.0000000000000001,
        "twentyDigitInteger": 12345678901234567890
      },
      "orderedArray": [
        3,
        1,
        2
      ],
      "": "private use U+E000: one UTF-16 code unit, below every supplementary code point",
      "💶": "U+1F4B6: one code point above U+FFFF, two UTF-16 code units starting at U+D83D"
    }
  },
  "source": {
    "syntax": "UBL",
    "sha256": "228f74263f1a2795e21bc4a659c60afbe31a4ba71392e335e3e5e68953731be5"
  }
}
