{
  "format": "EN16931-Semantic-JSON",
  "version": "1.0",
  "semanticModel": "EN16931-1:2017+A1:2019/AC:2020",
  "values": {
    "/BT-1": "112233",
    "/BT-2": "2021-04-23",
    "/BT-3": "380",
    "/BT-5": "EUR",
    "/BT-9": "2021-04-28",
    "/BT-10": "991-33333TEST-33",
    "/BG-1/0/BT-21": "ADU",
    "/BG-1/0/BT-22": "Rechnung enthält 100 EUR (Umsatz)Steuer auf Altteile gem. Abschn. 10.5 Abs. 3 UStAE",
    "/BG-2/BT-23": "urn:fdc:peppol.eu:2017:poacc:billing:01:1.0",
    "/BG-2/BT-24": "urn:cen.eu:en16931:2017#compliant#urn:xeinkauf.de:kosit:xrechnung_3.0",
    "/BG-4/BT-27": "Testverkäufer",
    "/BG-4/BT-29/0": "116078",
    "/BG-4/BT-31": "DE12345464867",
    "/BG-4/BT-32": "1121081508150",
    "/BG-4/BT-34": {
      "value": "seller@email.de",
      "scheme": "EM"
    },
    "/BG-4/BG-5/BT-35": "Teststraße ",
    "/BG-4/BG-5/BT-37": "Testhausen",
    "/BG-4/BG-5/BT-38": "12345",
    "/BG-4/BG-5/BT-40": "DE",
    "/BG-4/BG-6/BT-41": "Test",
    "/BG-4/BG-6/BT-42": "123456789",
    "/BG-4/BG-6/BT-43": "test@test.de",
    "/BG-7/BT-44": "Testkäufer",
    "/BG-7/BT-49": {
      "value": "buyer@info.de",
      "scheme": "EM"
    },
    "/BG-7/BG-8/BT-50": "Teststraße ",
    "/BG-7/BG-8/BT-52": "Testhausen",
    "/BG-7/BG-8/BT-53": "12345",
    "/BG-7/BG-8/BT-55": "DE",
    "/BG-13/BT-72": "2020-11-23",
    "/BG-16/BT-81": "58",
    "/BG-16/BT-82": "SEPA-Überweisung",
    "/BG-16/BG-17/0/BT-84": "DE79000000001234567890",
    "/BG-16/BG-17/0/BT-85": "Testkäufer",
    "/BG-22/BT-106": "1500",
    "/BG-22/BT-109": "1500",
    "/BG-22/BT-110": "304",
    "/BG-22/BT-112": "1804",
    "/BG-22/BT-115": "1804",
    "/BG-23/0/BT-116": "1600",
    "/BG-23/0/BT-117": "304",
    "/BG-23/0/BT-118": "S",
    "/BG-23/0/BT-119": "19",
    "/BG-23/1/BT-116": "-100",
    "/BG-23/1/BT-117": "0",
    "/BG-23/1/BT-118": "Z",
    "/BG-23/1/BT-119": "0",
    "/BG-25/0/BT-126": "1",
    "/BG-25/0/BT-129": "1",
    "/BG-25/0/BT-130": "C62",
    "/BG-25/0/BT-131": "1000",
    "/BG-25/0/BG-29/BT-146": "1000",
    "/BG-25/0/BG-29/BT-147": "10",
    "/BG-25/0/BG-29/BT-148": "1010",
    "/BG-25/0/BG-30/BT-151": "S",
    "/BG-25/0/BG-30/BT-152": "19",
    "/BG-25/0/BG-31/BT-153": "Neumotor",
    "/BG-25/1/BT-126": "2",
    "/BG-25/1/BT-129": "1",
    "/BG-25/1/BT-130": "C62",
    "/BG-25/1/BT-131": "100",
    "/BG-25/1/BG-29/BT-146": "100",
    "/BG-25/1/BG-29/BT-147": "10",
    "/BG-25/1/BG-29/BT-148": "110",
    "/BG-25/1/BG-30/BT-151": "S",
    "/BG-25/1/BG-30/BT-152": "19",
    "/BG-25/1/BG-31/BT-153": "Bemessungsgrundlage und Umsatzsteuer auf Altteil",
    "/BG-25/2/BT-126": "3",
    "/BG-25/2/BT-129": "-1",
    "/BG-25/2/BT-130": "C62",
    "/BG-25/2/BT-131": "-100",
    "/BG-25/2/BG-29/BT-146": "100",
    "/BG-25/2/BG-29/BT-147": "10",
    "/BG-25/2/BG-29/BT-148": "110",
    "/BG-25/2/BG-30/BT-151": "Z",
    "/BG-25/2/BG-30/BT-152": "0",
    "/BG-25/2/BG-31/BT-153": "Korrektur/Stornierung Bemessungsgrundlage der Umsatzsteuer auf Altteil",
    "/BG-25/3/BT-126": "4",
    "/BG-25/3/BT-129": "1",
    "/BG-25/3/BT-130": "HUR",
    "/BG-25/3/BT-131": "500",
    "/BG-25/3/BG-29/BT-146": "500",
    "/BG-25/3/BG-29/BT-147": "10",
    "/BG-25/3/BG-29/BT-148": "510",
    "/BG-25/3/BG-30/BT-151": "S",
    "/BG-25/3/BG-30/BT-152": "19",
    "/BG-25/3/BG-31/BT-153": "Montage"
  },
  "source": {
    "syntax": "CII",
    "sha256": "7401cbb320bd2dd9665b27eb594dcfe5d577184cd6c1c85a22773a643da71d35"
  }
}
