{
  "format": "EN16931-Semantic-JSON",
  "version": "1.0",
  "semanticModel": "EN16931-1:2017+A1:2019/AC:2020",
  "values": {
    "/BT-1": "ÿþRE-2026-0042",
    "/BT-2": "2026-02-03",
    "/BT-3": "380",
    "/BT-5": "EUR",
    "/BT-9": "2026-03-05",
    "/BT-10": "KOST-4711",
    "/BT-12": "RV-2025-118",
    "/BT-13": "BE-2026-0091",
    "/BT-19": "Cost centre 4711",
    "/BT-20": "Payable within 30 days without deduction.",
    "/BG-1/0/BT-22": "Delivery and performance according to contract RV-2025-118.\nPlease quote the invoice number with the payment.",
    "/BG-2/BT-24": "urn:cen.eu:en16931:2017",
    "/BG-4/BT-27": "Example GmbH",
    "/BG-4/BT-28": "Example Systems",
    "/BG-4/BT-29/0": {
      "value": "4399901000018",
      "scheme": "0088"
    },
    "/BG-4/BT-30": "HRB 12345",
    "/BG-4/BT-31": "DE123456789",
    "/BG-4/BT-33": "Managing director: Alex Beispiel, register court Beispielstadt HRB 12345",
    "/BG-4/BT-34": {
      "value": "invoices@example.invalid",
      "scheme": "EM"
    },
    "/BG-4/BG-5/BT-35": "Musterweg 12",
    "/BG-4/BG-5/BT-37": "Beispielstadt",
    "/BG-4/BG-5/BT-38": "10117",
    "/BG-4/BG-5/BT-40": "DE",
    "/BG-4/BG-6/BT-41": "Accounts receivable",
    "/BG-4/BG-6/BT-42": "+49 30 1234567",
    "/BG-4/BG-6/BT-43": "billing@example.invalid",
    "/BG-7/BT-44": "Muster AG",
    "/BG-7/BT-46": {
      "value": "4399902000024",
      "scheme": "0088"
    },
    "/BG-7/BT-48": "DE987654321",
    "/BG-7/BT-49": {
      "value": "rechnung@muster.invalid",
      "scheme": "EM"
    },
    "/BG-7/BG-8/BT-50": "Beispielallee 3",
    "/BG-7/BG-8/BT-52": "Musterstadt",
    "/BG-7/BG-8/BT-53": "20095",
    "/BG-7/BG-8/BT-55": "DE",
    "/BG-7/BG-9/BT-56": "Purchasing",
    "/BG-7/BG-9/BT-57": "+49 40 7654321",
    "/BG-7/BG-9/BT-58": "purchasing@muster.invalid",
    "/BG-13/BT-72": "2026-01-30",
    "/BG-16/BT-81": "58",
    "/BG-16/BT-83": "RE-2026-0042",
    "/BG-16/BG-17/0/BT-84": "DE89370400440532013000",
    "/BG-16/BG-17/0/BT-85": "Example GmbH",
    "/BG-16/BG-17/0/BT-86": "COBADEFFXXX",
    "/BG-22/BT-106": "2450",
    "/BG-22/BT-109": "2450",
    "/BG-22/BT-110": "465.5",
    "/BG-22/BT-112": "2915.5",
    "/BG-22/BT-115": "2915.5",
    "/BG-23/0/BT-116": "2450",
    "/BG-23/0/BT-117": "465.5",
    "/BG-23/0/BT-118": "S",
    "/BG-23/0/BT-119": "19",
    "/BG-25/0/BT-126": "1",
    "/BG-25/0/BT-129": "10",
    "/BG-25/0/BT-130": "H87",
    "/BG-25/0/BT-131": "250",
    "/BG-25/0/BT-132": "10",
    "/BG-25/0/BG-29/BT-146": "25",
    "/BG-25/0/BG-30/BT-151": "S",
    "/BG-25/0/BG-30/BT-152": "19",
    "/BG-25/0/BG-31/BT-153": "Sensor module SM-100",
    "/BG-25/0/BG-31/BT-154": "Sensor module, housing grey",
    "/BG-25/0/BG-31/BT-155": "SM-100",
    "/BG-25/1/BT-126": "2",
    "/BG-25/1/BT-129": "3",
    "/BG-25/1/BT-130": "DAY",
    "/BG-25/1/BT-131": "1440",
    "/BG-25/1/BT-132": "20",
    "/BG-25/1/BG-29/BT-146": "480",
    "/BG-25/1/BG-30/BT-151": "S",
    "/BG-25/1/BG-30/BT-152": "19",
    "/BG-25/1/BG-31/BT-153": "On-site installation",
    "/BG-25/2/BT-126": "3",
    "/BG-25/2/BT-127": "Two sessions of four hours.",
    "/BG-25/2/BT-129": "8",
    "/BG-25/2/BT-130": "HUR",
    "/BG-25/2/BT-131": "760",
    "/BG-25/2/BG-29/BT-146": "95",
    "/BG-25/2/BG-30/BT-151": "S",
    "/BG-25/2/BG-30/BT-152": "19",
    "/BG-25/2/BG-31/BT-153": "Training"
  }
}
