{
  "format": "EN16931-Semantic-JSON",
  "version": "1.0",
  "semanticModel": "EN16931-1:2017+A1:2019/AC:2020",
  "values": {
    "/BT-1": "Rechnungsnummer",
    "/BT-2": "2015-01-09",
    "/BT-3": "380",
    "/BT-5": "EUR",
    "/BT-9": "2015-01-24",
    "/BT-10": "04011000-12354-73",
    "/BT-11": "PR12345678",
    "/BT-13": "Dummywert",
    "/BT-14": "Auftragsnummer",
    "/BT-20": "Bitte überweisen Sie bis zum 24.01.2015 auf das unten aufgeführte Konto.",
    "/BG-1/0/BT-21": "ADU",
    "/BG-1/0/BT-22": "Bearbeitungszeitraum: Dezember 2014/ 5.01.-09.01.2015 Abschlagsrechnung A 9",
    "/BG-2/BT-23": "urn:fdc:peppol.eu:2017:poacc:billing:01:1.0",
    "/BG-2/BT-24": "urn:cen.eu:en16931:2017#compliant#urn:xeinkauf.de:kosit:xrechnung_3.0",
    "/BG-4/BT-27": "[Seller name]",
    "/BG-4/BT-30": "HRB 123",
    "/BG-4/BT-31": "DE123456789",
    "/BG-4/BT-32": "123/456/789",
    "/BG-4/BT-34": {
      "value": "seller@email.de",
      "scheme": "EM"
    },
    "/BG-4/BG-5/BT-35": "[Seller address line 1]",
    "/BG-4/BG-5/BT-37": "[Seller city]",
    "/BG-4/BG-5/BT-38": "12345",
    "/BG-4/BG-5/BT-40": "DE",
    "/BG-4/BG-6/BT-41": "[Seller contact person]",
    "/BG-4/BG-6/BT-42": "1234567890",
    "/BG-4/BG-6/BT-43": "info@seller.de",
    "/BG-7/BT-44": "[Buyer name]",
    "/BG-7/BT-49": {
      "value": "buyer@info.de",
      "scheme": "EM"
    },
    "/BG-7/BG-8/BT-50": "[Buyer address line 1]",
    "/BG-7/BG-8/BT-52": "[Buyer city]",
    "/BG-7/BG-8/BT-53": "12345",
    "/BG-7/BG-8/BT-55": "DE",
    "/BG-16/BT-81": "58",
    "/BG-16/BG-17/0/BT-84": "DE79000000001234567890",
    "/BG-22/BT-106": "5330",
    "/BG-22/BT-109": "5330",
    "/BG-22/BT-110": "1012.7",
    "/BG-22/BT-112": "6342.7",
    "/BG-22/BT-115": "6342.7",
    "/BG-23/0/BT-116": "5330",
    "/BG-23/0/BT-117": "1012.7",
    "/BG-23/0/BT-118": "S",
    "/BG-23/0/BT-119": "19",
    "/BG-25/0/BT-126": "7",
    "/BG-25/0/BT-129": "1",
    "/BG-25/0/BT-130": "XPP",
    "/BG-25/0/BT-131": "400",
    "/BG-25/0/BG-29/BT-146": "400",
    "/BG-25/0/BG-30/BT-151": "S",
    "/BG-25/0/BG-30/BT-152": "19",
    "/BG-25/0/BG-31/BT-153": "Aussetzen der Kanten Neorokokosofa laut N2",
    "/BG-25/1/BT-126": "8",
    "/BG-25/1/BT-129": "1",
    "/BG-25/1/BT-130": "XPP",
    "/BG-25/1/BT-131": "240",
    "/BG-25/1/BG-29/BT-146": "240",
    "/BG-25/1/BG-30/BT-151": "S",
    "/BG-25/1/BG-30/BT-152": "19",
    "/BG-25/1/BG-31/BT-153": "Aussetzen der Kanten am Sofa um 1780 laut N2",
    "/BG-25/2/BT-126": "9",
    "/BG-25/2/BT-129": "1",
    "/BG-25/2/BT-130": "XPP",
    "/BG-25/2/BT-131": "120",
    "/BG-25/2/BG-29/BT-146": "120",
    "/BG-25/2/BG-30/BT-151": "S",
    "/BG-25/2/BG-30/BT-152": "19",
    "/BG-25/2/BG-31/BT-153": "Analyse Pigment",
    "/BG-25/3/BT-126": "10",
    "/BG-25/3/BT-129": "1",
    "/BG-25/3/BT-130": "XPP",
    "/BG-25/3/BT-131": "70",
    "/BG-25/3/BG-29/BT-146": "70",
    "/BG-25/3/BG-30/BT-151": "S",
    "/BG-25/3/BG-30/BT-152": "19",
    "/BG-25/3/BG-31/BT-153": "Querschliff",
    "/BG-25/4/BT-126": "5.2",
    "/BG-25/4/BT-129": "1",
    "/BG-25/4/BT-130": "XPP",
    "/BG-25/4/BT-131": "140",
    "/BG-25/4/BG-29/BT-146": "140",
    "/BG-25/4/BG-30/BT-151": "S",
    "/BG-25/4/BG-30/BT-152": "19",
    "/BG-25/4/BG-31/BT-153": "Furnierniederlegung 50 %",
    "/BG-25/5/BT-126": "2",
    "/BG-25/5/BT-129": "1",
    "/BG-25/5/BT-130": "XPP",
    "/BG-25/5/BT-131": "400",
    "/BG-25/5/BG-29/BT-146": "400",
    "/BG-25/5/BG-30/BT-151": "S",
    "/BG-25/5/BG-30/BT-152": "19",
    "/BG-25/5/BG-31/BT-153": "Transport 25 %",
    "/BG-25/6/BT-126": "7.1",
    "/BG-25/6/BT-129": "1",
    "/BG-25/6/BT-130": "XPP",
    "/BG-25/6/BT-131": "280",
    "/BG-25/6/BG-29/BT-146": "280",
    "/BG-25/6/BG-30/BT-151": "S",
    "/BG-25/6/BG-30/BT-152": "19",
    "/BG-25/6/BG-31/BT-153": "Sofa um 1780 Reinigung der Oberfläche",
    "/BG-25/7/BT-126": "7.2",
    "/BG-25/7/BT-129": "1",
    "/BG-25/7/BT-130": "XPP",
    "/BG-25/7/BT-131": "480",
    "/BG-25/7/BG-29/BT-146": "480",
    "/BG-25/7/BG-30/BT-151": "S",
    "/BG-25/7/BG-30/BT-152": "19",
    "/BG-25/7/BG-31/BT-153": "Konstruktive Ertüchtigung, Ergänzung eines Beines",
    "/BG-25/8/BT-126": "7.3",
    "/BG-25/8/BT-129": "1",
    "/BG-25/8/BT-130": "XPP",
    "/BG-25/8/BT-131": "1600",
    "/BG-25/8/BG-29/BT-146": "1600",
    "/BG-25/8/BG-30/BT-151": "S",
    "/BG-25/8/BG-30/BT-152": "19",
    "/BG-25/8/BG-31/BT-153": "Abnahme der rotbraunen Fassung 50 %",
    "/BG-25/9/BT-126": "9.1",
    "/BG-25/9/BT-129": "1",
    "/BG-25/9/BT-130": "XPP",
    "/BG-25/9/BT-131": "400",
    "/BG-25/9/BG-29/BT-146": "400",
    "/BG-25/9/BG-30/BT-151": "S",
    "/BG-25/9/BG-30/BT-152": "19",
    "/BG-25/9/BG-31/BT-153": "Neorokokosofo konstruktive Ertüchtigung",
    "/BG-25/10/BT-126": "9.2",
    "/BG-25/10/BT-129": "1",
    "/BG-25/10/BT-130": "XPP",
    "/BG-25/10/BT-131": "1200",
    "/BG-25/10/BG-29/BT-146": "1200",
    "/BG-25/10/BG-30/BT-151": "S",
    "/BG-25/10/BG-30/BT-152": "19",
    "/BG-25/10/BG-31/BT-153": "Reinigung, Fassungssicherung 50 %"
  },
  "source": {
    "syntax": "UBL",
    "sha256": "03558b27fea3e1270786eb8da84a31457bcbd7c0cfe018698cf6bd54c154db52"
  }
}
