{
  "format": "EN16931-Semantic-JSON",
  "version": "1.0",
  "semanticModel": "EN16931-1:2017+A1:2019/AC:2020",
  "values": {
    "/BT-1": "R123456789",
    "/BT-2": "2016-01-18",
    "/BT-3": "380",
    "/BT-5": "EUR",
    "/BT-9": "2016-02-01",
    "/BT-10": "04011000-12349-88",
    "/BT-12": "V876543210",
    "/BT-13": "Dummywert",
    "/BT-14": "A123456789",
    "/BT-20": "Die Zahlung wird als Teilleistung monatl. Erbracht und ist monatl. zum letzten Werktag fällig. …",
    "/BG-2/BT-23": "urn:fdc:peppol.eu:2017:poacc:billing:01:1.0",
    "/BG-2/BT-24": "urn:cen.eu:en16931:2017#compliant#urn:xeinkauf.de:kosit:xrechnung_3.0",
    "/BG-4/BT-27": "[Seller name]",
    "/BG-4/BT-28": "[Seller trading name]",
    "/BG-4/BT-30": "HRB 123",
    "/BG-4/BT-31": "DE123456789",
    "/BG-4/BT-33": "Amtsgericht […], Geschäftsführer: […], Sitz der Gesellschaft […], Aufsichtsratvorsitzender: […]",
    "/BG-4/BT-34": {
      "value": "seller@email.de",
      "scheme": "EM"
    },
    "/BG-4/BG-5/BT-35": "Postfach 123456",
    "/BG-4/BG-5/BT-37": "[Seller city]",
    "/BG-4/BG-5/BT-38": "12345",
    "/BG-4/BG-5/BT-40": "DE",
    "/BG-4/BG-6/BT-41": "Auskunft erteilt Ihnen",
    "/BG-4/BG-6/BT-42": "1234567890",
    "/BG-4/BG-6/BT-43": "seller@test.de",
    "/BG-7/BT-44": "[Buyer name]",
    "/BG-7/BT-49": {
      "value": "buyer@info.de",
      "scheme": "EM"
    },
    "/BG-7/BG-8/BT-50": "[Buyer address line 1]",
    "/BG-7/BG-8/BT-52": "[Buyer city]",
    "/BG-7/BG-8/BT-53": "12345",
    "/BG-7/BG-8/BT-55": "DE",
    "/BG-16/BT-81": "58",
    "/BG-16/BG-17/0/BT-84": "DE79000000001234567890",
    "/BG-16/BG-17/1/BT-84": "DE16000000002345678901",
    "/BG-16/BG-17/2/BT-84": "DE03000000003456789012",
    "/BG-22/BT-106": "2374.68",
    "/BG-22/BT-109": "2374.68",
    "/BG-22/BT-110": "451.19",
    "/BG-22/BT-112": "2825.87",
    "/BG-22/BT-115": "2825.87",
    "/BG-23/0/BT-116": "2374.68",
    "/BG-23/0/BT-117": "451.19",
    "/BG-23/0/BT-118": "S",
    "/BG-23/0/BT-119": "19",
    "/BG-25/0/BT-126": "0020",
    "/BG-25/0/BT-129": "12",
    "/BG-25/0/BT-130": "XPP",
    "/BG-25/0/BT-131": "2374.68",
    "/BG-25/0/BG-29/BT-146": "197.89",
    "/BG-25/0/BG-30/BT-151": "S",
    "/BG-25/0/BG-30/BT-152": "19",
    "/BG-25/0/BG-31/BT-153": "Zentrale Administrationslösung Bereitstellung von Werkzeugen zur Administration/Betreuung",
    "/BG-25/0/BG-31/BT-155": "519304"
  },
  "source": {
    "syntax": "UBL",
    "sha256": "b38c9d2666dd6e18f992a955b5d3f94950252dbdfa1927420f0fe511734ae37c"
  }
}
